<?xml version="1.0" encoding="UTF-8"?>
<race name="Question2" width="1000" height="40" xmlns:xsi="http://www.w3.org/2001/XMLSchema-instance" xsi:noNamespaceSchemaLocation="RaceSchema.xsd">
	<asteroid x="74.85845" y="-20.0" model="asteroid.jme" />
	<asteroid x="74.85845" y="-16.0" model="asteroid.jme" />
	<asteroid x="74.85845" y="-12.0" model="asteroid.jme" />
	<asteroid x="74.85845" y="-8.0" model="asteroid.jme" />
	<asteroid x="74.85845" y="-4.0" model="asteroid.jme" />
	<asteroid x="74.85845" y="0.0" model="asteroid.jme" />
	<asteroid x="74.85845" y="4.0" model="asteroid.jme" />
	<asteroid x="189.06648" y="0.0" model="asteroid.jme" />
	<asteroid x="189.06648" y="4.0" model="asteroid.jme" />
	<asteroid x="189.06648" y="8.0" model="asteroid.jme" />
	<asteroid x="189.06648" y="12.0" model="asteroid.jme" />
	<asteroid x="189.06648" y="16.0" model="asteroid.jme" />
	<asteroid x="189.06648" y="20.0" model="asteroid.jme" />
	<asteroid x="301.36996" y="-20.0" model="asteroid.jme" />
	<asteroid x="301.36996" y="-16.0" model="asteroid.jme" />
	<asteroid x="301.36996" y="-12.0" model="asteroid.jme" />
	<asteroid x="301.36996" y="-8.0" model="asteroid.jme" />
	<asteroid x="301.36996" y="-4.0" model="asteroid.jme" />
	<asteroid x="301.36996" y="0.0" model="asteroid.jme" />
	<asteroid x="301.36996" y="4.0" model="asteroid.jme" />
	<asteroid x="417.53955" y="0.0" model="asteroid.jme" />
	<asteroid x="417.53955" y="4.0" model="asteroid.jme" />
	<asteroid x="417.53955" y="8.0" model="asteroid.jme" />
	<asteroid x="417.53955" y="12.0" model="asteroid.jme" />
	<asteroid x="417.53955" y="16.0" model="asteroid.jme" />
	<asteroid x="417.53955" y="20.0" model="asteroid.jme" />
	<asteroid x="529.38617" y="-20.0" model="asteroid.jme" />
	<asteroid x="529.38617" y="-16.0" model="asteroid.jme" />
	<asteroid x="529.38617" y="-12.0" model="asteroid.jme" />
	<asteroid x="529.38617" y="-8.0" model="asteroid.jme" />
	<asteroid x="529.38617" y="-4.0" model="asteroid.jme" />
	<asteroid x="529.38617" y="0.0" model="asteroid.jme" />
	<asteroid x="529.38617" y="4.0" model="asteroid.jme" />
	<asteroid x="643.6852" y="-4.0" model="asteroid.jme" />
	<asteroid x="643.6852" y="0.0" model="asteroid.jme" />
	<asteroid x="643.6852" y="4.0" model="asteroid.jme" />
	<asteroid x="643.6852" y="8.0" model="asteroid.jme" />
	<asteroid x="643.6852" y="12.0" model="asteroid.jme" />
	<asteroid x="643.6852" y="16.0" model="asteroid.jme" />
	<asteroid x="643.6852" y="20.0" model="asteroid.jme" />
	<asteroid x="762.77637" y="-20.0" model="asteroid.jme" />
	<asteroid x="762.77637" y="-16.0" model="asteroid.jme" />
	<asteroid x="762.77637" y="-12.0" model="asteroid.jme" />
	<asteroid x="762.77637" y="-8.0" model="asteroid.jme" />
	<asteroid x="762.77637" y="-4.0" model="asteroid.jme" />
	<asteroid x="762.77637" y="0.0" model="asteroid.jme" />
	<asteroid x="762.77637" y="4.0" model="asteroid.jme" />
	<asteroid x="886.7395" y="-4.0" model="asteroid.jme" />
	<asteroid x="886.7395" y="0.0" model="asteroid.jme" />
	<asteroid x="886.7395" y="4.0" model="asteroid.jme" />
	<asteroid x="886.7395" y="8.0" model="asteroid.jme" />
	<asteroid x="886.7395" y="12.0" model="asteroid.jme" />
	<asteroid x="886.7395" y="16.0" model="asteroid.jme" />
	<asteroid x="886.7395" y="20.0" model="asteroid.jme" />
</race>